{
  "$schema": "https://json-schema.org/draft/2020-12/schema",
  "$id": "https://erp-town.local/schema/envelope.json",
  "title": "TownEventEnvelope",
  "description": "ERP Town event envelope (CloudEvents 1.0 based). Spec: docs/superpowers/specs/2026-10-07-foundation-design.md section 3.",
  "type": "object",
  "additionalProperties": false,
  "required": [
    "specversion",
    "id",
    "type",
    "source",
    "time",
    "schema_version",
    "company",
    "actor",
    "subject",
    "seq",
    "correlation_id",
    "causation_id",
    "visibility",
    "data"
  ],
  "properties": {
    "specversion": { "const": "1.0" },
    "id": { "$ref": "#/$defs/ulid" },
    "type": {
      "type": "string",
      "enum": [
        "erp.sales_order.submitted",
        "erp.sales_order.cancelled",
        "erp.delivery_note.submitted",
        "erp.delivery_note.cancelled",
        "erp.sales_invoice.submitted",
        "erp.sales_invoice.cancelled",
        "erp.sales_invoice.overdue",
        "erp.payment_entry.submitted",
        "erp.payment_entry.cancelled",
        "erp.stock.below_reorder",
        "workflow.approval.requested",
        "workflow.approval.decided",
        "system.error"
      ]
    },
    "source": { "type": "string", "pattern": "^[a-z]+/[a-z_]+$" },
    "time": {
      "description": "ISO 8601 with the system timezone offset (Asia/Bangkok, +07:00).",
      "type": "string",
      "format": "date-time",
      "pattern": "^\\d{4}-\\d{2}-\\d{2}T\\d{2}:\\d{2}:\\d{2}(\\.\\d+)?(Z|[+-]\\d{2}:\\d{2})$"
    },
    "schema_version": { "const": 1 },
    "company": {
      "description": "Company code (the ERPNext Company abbr, e.g. ACME-TH), not the Company record name; null only for system.* events and subjects without a company (e.g. Item).",
      "type": ["string", "null"],
      "minLength": 1
    },
    "actor": { "$ref": "#/$defs/actor" },
    "subject": { "$ref": "#/$defs/subject" },
    "seq": {
      "description": "Per-subject sequence, starting at 1, shared by all event types and statuses of that subject. Gaps are expected: Invalid events take a seq but are never published, and system.error events are role-restricted. Order by seq; never wait for a missing seq.",
      "type": "integer",
      "minimum": 1
    },
    "correlation_id": { "type": "string", "minLength": 1 },
    "causation_id": {
      "anyOf": [{ "$ref": "#/$defs/ulid" }, { "type": "null" }]
    },
    "visibility": { "$ref": "#/$defs/visibility" },
    "data": { "type": "object" }
  },
  "allOf": [
    { "$ref": "#/$defs/no_money_in_public" },
    {
      "if": {
        "required": ["type"],
        "properties": { "type": { "const": "erp.sales_order.submitted" } }
      },
      "then": { "properties": { "data": { "$ref": "events/erp.sales_order.submitted.json" } } }
    },
    {
      "if": {
        "required": ["type"],
        "properties": { "type": { "const": "erp.sales_order.cancelled" } }
      },
      "then": { "properties": { "data": { "$ref": "events/erp.sales_order.cancelled.json" } } }
    },
    {
      "if": {
        "required": ["type"],
        "properties": { "type": { "const": "erp.delivery_note.submitted" } }
      },
      "then": { "properties": { "data": { "$ref": "events/erp.delivery_note.submitted.json" } } }
    },
    {
      "if": {
        "required": ["type"],
        "properties": { "type": { "const": "erp.delivery_note.cancelled" } }
      },
      "then": { "properties": { "data": { "$ref": "events/erp.delivery_note.cancelled.json" } } }
    },
    {
      "if": {
        "required": ["type"],
        "properties": { "type": { "const": "erp.sales_invoice.submitted" } }
      },
      "then": { "properties": { "data": { "$ref": "events/erp.sales_invoice.submitted.json" } } }
    },
    {
      "if": {
        "required": ["type"],
        "properties": { "type": { "const": "erp.sales_invoice.cancelled" } }
      },
      "then": { "properties": { "data": { "$ref": "events/erp.sales_invoice.cancelled.json" } } }
    },
    {
      "if": {
        "required": ["type"],
        "properties": { "type": { "const": "erp.sales_invoice.overdue" } }
      },
      "then": { "properties": { "data": { "$ref": "events/erp.sales_invoice.overdue.json" } } }
    },
    {
      "if": {
        "required": ["type"],
        "properties": { "type": { "const": "erp.payment_entry.submitted" } }
      },
      "then": { "properties": { "data": { "$ref": "events/erp.payment_entry.submitted.json" } } }
    },
    {
      "if": {
        "required": ["type"],
        "properties": { "type": { "const": "erp.payment_entry.cancelled" } }
      },
      "then": { "properties": { "data": { "$ref": "events/erp.payment_entry.cancelled.json" } } }
    },
    {
      "if": {
        "required": ["type"],
        "properties": { "type": { "const": "erp.stock.below_reorder" } }
      },
      "then": { "properties": { "data": { "$ref": "events/erp.stock.below_reorder.json" } } }
    },
    {
      "if": {
        "required": ["type"],
        "properties": { "type": { "const": "workflow.approval.requested" } }
      },
      "then": { "properties": { "data": { "$ref": "events/workflow.approval.requested.json" } } }
    },
    {
      "if": {
        "required": ["type"],
        "properties": { "type": { "const": "workflow.approval.decided" } }
      },
      "then": { "properties": { "data": { "$ref": "events/workflow.approval.decided.json" } } }
    },
    {
      "if": { "required": ["type"], "properties": { "type": { "const": "system.error" } } },
      "then": { "properties": { "data": { "$ref": "events/system.error.json" } } }
    }
  ],
  "$defs": {
    "ulid": {
      "description": "26-character Crockford base32 ULID.",
      "type": "string",
      "pattern": "^[0-9A-HJKMNP-TV-Z]{26}$"
    },
    "actor": {
      "type": "object",
      "additionalProperties": false,
      "required": ["kind", "id", "on_behalf_of"],
      "properties": {
        "kind": { "type": "string", "enum": ["user", "agent", "system", "dev"] },
        "id": { "type": "string", "minLength": 1 },
        "on_behalf_of": { "type": ["string", "null"], "minLength": 1 }
      },
      "if": { "properties": { "kind": { "const": "agent" } } },
      "else": { "properties": { "on_behalf_of": { "type": "null" } } }
    },
    "subject": {
      "type": "object",
      "additionalProperties": false,
      "required": ["doctype", "name"],
      "properties": {
        "doctype": { "type": "string", "minLength": 1 },
        "name": { "type": "string", "minLength": 1 }
      }
    },
    "visibility": {
      "type": "object",
      "additionalProperties": false,
      "required": ["level", "roles"],
      "properties": {
        "level": { "type": "string", "enum": ["public", "roles", "private"] },
        "roles": {
          "type": "array",
          "uniqueItems": true,
          "items": { "type": "string", "minLength": 1 }
        }
      },
      "if": { "properties": { "level": { "const": "roles" } } },
      "then": { "properties": { "roles": { "type": "array", "minItems": 1 } } }
    },
    "money": {
      "description": "Money amount. Allowed in event data only when visibility.level is not public; no slice-1 event type uses it.",
      "type": "object",
      "additionalProperties": false,
      "required": ["amount", "currency"],
      "properties": {
        "amount": { "type": "number" },
        "currency": { "type": "string", "pattern": "^[A-Z]{3}$" }
      }
    },
    "no_money_in_public": {
      "description": "Public events must not carry money fields: data may not contain any reserved money property name.",
      "type": "object",
      "if": {
        "required": ["visibility"],
        "properties": {
          "visibility": {
            "type": "object",
            "required": ["level"],
            "properties": { "level": { "const": "public" } }
          }
        }
      },
      "then": {
        "properties": {
          "data": {
            "type": "object",
            "propertyNames": {
              "not": {
                "enum": [
                  "grand_total",
                  "net_total",
                  "total",
                  "outstanding_amount",
                  "paid_amount",
                  "amount"
                ]
              }
            }
          }
        }
      }
    }
  }
}
