{
  "specversion": "1.0",
  "id": "01JA0K6Y8Z9P3R4S5T6V7W8XA2",
  "type": "erp.delivery_note.submitted",
  "source": "erp/stock",
  "time": "2026-10-08T09:00:00+07:00",
  "schema_version": 1,
  "company": "ACME-TH",
  "actor": {
    "kind": "user",
    "id": "user.somchai@acme.example",
    "on_behalf_of": null
  },
  "subject": {
    "doctype": "Delivery Note",
    "name": "DN6910-0017"
  },
  "seq": 1,
  "correlation_id": "SO6910-0042",
  "causation_id": "01JA0K6Y8Z9P3R4S5T6V7W8XA1",
  "visibility": {
    "level": "public",
    "roles": []
  },
  "data": {
    "status": "To Bill",
    "party": "CUST-001",
    "item_count": 3,
    "warehouse": "Stores - ACME",
    "against": ["SO6910-0042"]
  }
}
