{
  "specversion": "1.0",
  "id": "01JA0K6Y8Z9P3R4S5T6V7W8XB1",
  "type": "workflow.approval.requested",
  "source": "erp/workflow",
  "time": "2026-10-07T10:20:00+07:00",
  "schema_version": 1,
  "company": "ACME-TH",
  "actor": {
    "kind": "agent",
    "id": "agent.sales_assistant",
    "on_behalf_of": "user.somchai@acme.example"
  },
  "subject": {
    "doctype": "Sales Order",
    "name": "SO6910-0044"
  },
  "seq": 1,
  "correlation_id": "SO6910-0044",
  "causation_id": null,
  "visibility": {
    "level": "public",
    "roles": []
  },
  "data": {
    "from_state": "Draft",
    "to_state": "Pending Approval",
    "approver_role": "Sales Manager"
  }
}
